{
	"$schema": "https://json-schema.org/draft/2020-12/schema",
	"$id": "https://raw.githubusercontent.com/alexandrosnt/reach-recipes-registry/main/schema.json",
	"title": "Reach recipes registry index",
	"description": "The shape of recipes.json. Generated by build-index.mjs — do not hand-edit the index; edit the recipe and regenerate, or the sha256 goes stale and every install of that recipe fails.",
	"type": "array",
	"items": {
		"type": "object",
		"required": ["id", "name", "url", "sha256"],
		"additionalProperties": false,
		"properties": {
			"id": {
				"type": "string",
				"pattern": "^[a-z0-9]([a-z0-9-]*[a-z0-9])?$",
				"maxLength": 64,
				"description": "Stable identifier. Becomes the filename on disk, so it must not contain a path separator."
			},
			"name": {
				"type": "string",
				"minLength": 1,
				"description": "Shown in the list."
			},
			"version": {
				"type": "string",
				"pattern": "^\\d+\\.\\d+\\.\\d+$",
				"description": "Semver. Bump it whenever the script changes."
			},
			"description": {
				"type": "string",
				"description": "One line, shown under the name and above the run button."
			},
			"author": { "type": "string" },
			"repo": {
				"type": "string",
				"description": "owner/name, for the Source link. Informational."
			},
			"tags": {
				"type": "array",
				"items": { "type": "string" },
				"description": "Search terms."
			},
			"targets": {
				"type": "array",
				"items": { "type": "string" },
				"description": "Distros the author wrote this for. Advisory: nothing checks it, because guessing wrong and refusing to run would be worse than letting someone decide for themselves."
			},
			"danger": {
				"type": ["string", "null"],
				"enum": ["benign", "mutating", "sensitive", "destructive", null],
				"description": "What the author declares. Reach analyses the script independently and shows the user when the two disagree."
			},
			"url": {
				"type": "string",
				"pattern": "^https://",
				"description": "Direct link to the .sh file. Must be https."
			},
			"sha256": {
				"type": "string",
				"pattern": "^[0-9a-f]{64}$",
				"description": "Hex SHA-256 of the bytes at url. Verified before anything is written to disk; a mismatch fails the install. This is what makes the maintainer's review mean something."
			}
		}
	}
}
